{"_D":"urn:oasis:names:specification:ubl:schema:xsd:CommonTransportationReport-2",
 "_A":"urn:oasis:names:specification:ubl:schema:xsd:CommonAggregateComponents-2",
 "_B":"urn:oasis:names:specification:ubl:schema:xsd:CommonBasicComponents-2",
 "CommonTransportationReport":[{
 "UBLVersionID":[{"_":"2.1"}],
 "CustomizationID":[{"_":"Common Framework"}],
 "ProfileID":[{"_":"ENS"}],
 "ID":[{"_":"224087496582335"}],
 "IssueDate":[{"_":"2013-05-08"}],
 "IssueTime":[{"_":"10:15:00+02:00"}],
 "DocumentStatusCode":[{"_":"NotConfirmed"}],
 "VersionID":[{"_":"1"}],
 "ReporterParty":[{
  "PartyIdentification":[{
   "ID":[{"_":"4058673827641",
    "schemeAgencyName":"GS1",
    "schemeName":"GLN"}]
  }],
  "PartyName":[{
   "Name":[{"_":"D2D GmbH"}]
  }],
  "Contact":[{
   "Name":[{"_":"SomeName"}],
   "Telephone":[{"_":"+49450557000"}],
   "ElectronicMail":[{"_":"SomeName@d2d.de"}]
  }]
 }],
 "SenderParty":[{
  "PartyName":[{
   "Name":[{"_":"Declarant Inc"}]
  }],
  "PostalAddress":[{
   "StreetName":[{"_":"Declarant Street"}],
   "CityName":[{"_":"Declarant City"}],
   "PostalZone":[{"_":"Declarant Post Code"}],
   "Country":[{
    "IdentificationCode":[{"_":"DE"}]
   }]
  }],
  "Contact":[{
   "Name":[{"_":"SomeName"}],
   "Telephone":[{"_":"+49450557000"}],
   "ElectronicMail":[{"_":"SomeName@d2d.de"}]
  }]
 }],
 "ReceiverParty":[{
  "PartyIdentification":[{
   "ID":[{"_":"4058675698641",
    "schemeAgencyName":"GS1",
    "schemeName":"GLN"}]
  }],
  "PartyName":[{
   "Name":[{"_":"Lisboa Harbour"}]
  }]
 }],
 "ReportingLocation":[{
  "Address":[{
   "StreetName":[{"_":"Declarant Street"}],
   "CityName":[{"_":"Declarant City"}],
   "PostalZone":[{"_":"Declarant Post Code"}],
   "Country":[{
    "IdentificationCode":[{"_":"DE"}]
   }]
  }]
 }],
 "Shipment":[{
  "Consignment":[{
   "ID":[{"_":"7365566156191234567",
    "schemeAgencyName":"GS1",
    "schemeName":"GINC"}],
   "GrossWeightMeasure":[{"_":600,
    "unitCode":"KGM"}],
   "TotalGoodsItemQuantity":[{"_":1500}],
   "TotalTransportHandlingUnitQuantity":[{"_":2}],
   "PlannedPickupTransportEvent":[{
    "Location":[{
     "ID":[{"_":"MAPTM",
      "schemeAgencyName":"UN",
      "schemeName":"LOCODE"}],
     "Address":[{
      "CityName":[{"_":"Tanger"}],
      "Country":[{
       "IdentificationCode":[{"_":"MA"}]
      }]
     }]
    }]
   }],
   "PlannedDeliveryTransportEvent":[{
    "Location":[{
     "ID":[{"_":"ITGOA",
      "schemeAgencyName":"UN",
      "schemeName":"LOCODE"}],
     "Address":[{
      "Country":[{
       "IdentificationCode":[{"_":"IT"}]
      }]
     }]
    }]
   }],
   "ConsigneeParty":[{
    "PartyName":[{
     "Name":[{"_":"Consignee W"}]
    }],
    "PostalAddress":[{
     "StreetName":[{"_":"Consignee W Street"}],
     "CityName":[{"_":"Munich"}],
     "PostalZone":[{"_":"231"}],
     "Country":[{
      "IdentificationCode":[{"_":"DE"}]
     }]
    }]
   }],
   "ConsignorParty":[{
    "PartyIdentification":[{
     "ID":[{"_":"4058673827000",
      "schemeAgencyName":"GS1",
      "schemeName":"GLN"}]
    }],
    "PartyName":[{
     "Name":[{"_":"Disfruta"}]
    }],
    "Contact":[{
     "Name":[{"_":"SomeName"}],
     "Telephone":[{"_":"+212687878763"}],
     "ElectronicMail":[{"_":"SomeName@disfruta.ma"}]
    }]
   }],
   "OriginalDepartureCountry":[{
    "IdentificationCode":[{"_":"MA"}]
   }],
   "FinalDestinationCountry":[{
    "IdentificationCode":[{"_":"DE"}]
   }],
   "TransitCountry":[{
    "IdentificationCode":[{"_":"IT"}]
   },{
    "IdentificationCode":[{"_":"AT"}]
   }],
   "MainCarriageShipmentStage":[{
    "ShipmentStageTypeCode":[{"_":"1"}],
    "TransportModeCode":[{"_":"1"}],
    "TransportMeans":[{
     "JourneyID":[{"_":"00344"}],
     "RegistrationNationalityID":[{"_":"IT"}],
     "MaritimeTransport":[{
      "VesselID":[{"_":"3852664"}],
      "VesselName":[{"_":"Vessel Name"}]
     }]
    }],
    "EstimatedArrivalTransportEvent":[{
     "OccurrenceDate":[{"_":"2013-05-25"}],
     "OccurrenceTime":[{"_":"18:00:00+01:00"}],
     "Location":[{
      "ID":[{"_":"ITGOA",
       "schemeName":"UNLOCODE"}],
      "LocationTypeCode":[{"_":"24"}],
      "Address":[{
       "Country":[{
        "IdentificationCode":[{"_":"IT"}]
       }]
      }]
     }]
    }]
   }],
   "TransportHandlingUnit":[{
    "ID":[{"_":"CON_THU_1"}],
    "TransportHandlingUnitTypeCode":[{"_":"4"}],
    "HazardousRiskIndicator":[{"_":false}],
    "ShippingMarks":[{"_":"Agricultural products"}],
    "TransportEquipment":[{
     "ID":[{"_":"BFCU4040001",
      "schemeName":"bic"}],
     "TransportEquipmentTypeCode":[{"_":"CN"}],
     "FullnessIndicationCode":[{"_":"1"}],
     "ReturnabilityIndicator":[{"_":true}],
     "RefrigeratedIndicator":[{"_":true}],
     "Description":[{"_":"Should have a temperature between 2-4 degrees celcius"}],
     "GrossWeightMeasure":[{"_":25000,
      "unitCode":"KGM"}],
     "GrossVolumeMeasure":[{"_":39,
      "unitCode":"MTQ"}],
     "PowerIndicator":[{"_":true}],
     "MeasurementDimension":[{
      "AttributeID":[{"_":"Length"}],
      "Measure":[{"_":6.1,
       "unitCode":"MTR"}]
     },{
      "AttributeID":[{"_":"Height"}],
      "Measure":[{"_":2.6,
       "unitCode":"MTR"}]
     },{
      "AttributeID":[{"_":"Width"}],
      "Measure":[{"_":2.44,
       "unitCode":"MTR"}]
     }],
     "GoodsItem":[{
      "Item":[{
       "CommodityClassification":[{
        "CargoTypeCode":[{"_":"14"}],
        "CommodityCode":[{"_":"8"}]
       }]
      }]
     }]
    }]
   },{
    "ID":[{"_":"CON_THU_2"}],
    "TransportHandlingUnitTypeCode":[{"_":"4"}],
    "HazardousRiskIndicator":[{"_":false}],
    "ShippingMarks":[{"_":"Agricultural products"}],
    "TransportEquipment":[{
     "ID":[{"_":"BFCU4040002",
      "schemeName":"bic"}],
     "TransportEquipmentTypeCode":[{"_":"CN"}],
     "FullnessIndicationCode":[{"_":"1"}],
     "ReturnabilityIndicator":[{"_":true}],
     "RefrigeratedIndicator":[{"_":true}],
     "Description":[{"_":"Should have a temperature between 2-4 degrees celcius"}],
     "GrossWeightMeasure":[{"_":25000,
      "unitCode":"KGM"}],
     "GrossVolumeMeasure":[{"_":39,
      "unitCode":"MTQ"}],
     "PowerIndicator":[{"_":true}],
     "MeasurementDimension":[{
      "AttributeID":[{"_":"Length"}],
      "Measure":[{"_":6.1,
       "unitCode":"MTR"}]
     },{
      "AttributeID":[{"_":"Height"}],
      "Measure":[{"_":2.6,
       "unitCode":"MTR"}]
     },{
      "AttributeID":[{"_":"Width"}],
      "Measure":[{"_":2.44,
       "unitCode":"MTR"}]
     }],
     "GoodsItem":[{
      "Item":[{
       "CommodityClassification":[{
        "CargoTypeCode":[{"_":"14"}],
        "CommodityCode":[{"_":"8"}]
       }]
      }]
     }]
    }]
   }],
   "FirstArrivalPortLocation":[{
    "ID":[{"_":"ITGOA",
     "schemeName":"UNLOCODE"}],
    "LocationTypeCode":[{"_":"41"}],
    "Address":[{
     "Country":[{
      "IdentificationCode":[{"_":"IT"}]
     }]
    }]
   }],
   "OfficeOfEntryLocation":[{
    "ID":[{"_":"DE000396"}],
    "LocationTypeCode":[{"_":"41"}],
    "Address":[{
     "Country":[{
      "IdentificationCode":[{"_":"DE"}]
     }]
    }]
   }]
  }]
 }],
 "DocumentReference":[{
  "ID":[{"_":"224087496582335"}],
  "DocumentTypeCode":[{"_":"704"}]
 }]
}]}